[
  {
    "caseContractVersion": "workout-import-acceptance-case/v3",
    "id": "WI-V3-A001",
    "category": "ordinaryLanguage",
    "locale": "en-GB",
    "prompt": "Indoor walking plan called Easy Hills: 5 minutes at 4 km/h and 0% incline, 10 minutes at 5 km/h and 2%, then 5 minutes at 4 km/h and 0%.",
    "capabilityProfile": "standardTreadmillV1",
    "scenarioFamily": "easy-hills-equivalent",
    "coverageTags": ["easyHillsExact", "implicitFirstKind", "implicitMiddleKind", "implicitLastKind"],
    "expected": {
      "outcome": "proposal",
      "suggestedNameExpectation": {
        "mode": "exact",
        "value": "Easy Hills"
      },
      "canonicalProposal": {
        "activity": "indoorWalking",
        "steps": [
          {"kind": "warmUp", "durationSeconds": 300, "speedKilometresPerHour": 4, "inclinationPercent": 0},
          {"kind": "interval", "durationSeconds": 600, "speedKilometresPerHour": 5, "inclinationPercent": 2},
          {"kind": "coolDown", "durationSeconds": 300, "speedKilometresPerHour": 4, "inclinationPercent": 0}
        ]
      },
      "normalisations": [],
      "localValidatorOutcome": "valid",
      "localValidatorIssueCodes": []
    }
  },
  {
    "caseContractVersion": "workout-import-acceptance-case/v3",
    "id": "WI-V3-A002",
    "category": "ordinaryLanguage",
    "locale": "en-GB",
    "prompt": "Call this indoor walking plan Easy Hills. Start with 5 minutes at 4 km/h and 0% incline. Continue for 10 minutes at 5 km/h and 2%. Finish with 5 minutes at 4 km/h and 0%.",
    "capabilityProfile": "standardTreadmillV1",
    "scenarioFamily": "easy-hills-equivalent",
    "coverageTags": ["easyHillsMultiSentence", "implicitFirstKind", "implicitMiddleKind", "implicitLastKind"],
    "expected": {
      "outcome": "proposal",
      "suggestedNameExpectation": {
        "mode": "exact",
        "value": "Easy Hills"
      },
      "canonicalProposal": {
        "activity": "indoorWalking",
        "steps": [
          {"kind": "warmUp", "durationSeconds": 300, "speedKilometresPerHour": 4, "inclinationPercent": 0},
          {"kind": "interval", "durationSeconds": 600, "speedKilometresPerHour": 5, "inclinationPercent": 2},
          {"kind": "coolDown", "durationSeconds": 300, "speedKilometresPerHour": 4, "inclinationPercent": 0}
        ]
      },
      "normalisations": [],
      "localValidatorOutcome": "valid",
      "localValidatorIssueCodes": []
    }
  },
  {
    "caseContractVersion": "workout-import-acceptance-case/v3",
    "id": "WI-V3-A003",
    "category": "ordinaryLanguage",
    "locale": "en-GB",
    "prompt": "indoor walking Easy Hills 5 minutes 4 km/h 0% 10 minutes 5 km/h 2% 5 minutes 4 km/h 0%",
    "capabilityProfile": "standardTreadmillV1",
    "scenarioFamily": "easy-hills-equivalent",
    "coverageTags": ["easyHillsFragment", "minimalPunctuation", "implicitFirstKind", "implicitMiddleKind", "implicitLastKind"],
    "expected": {
      "outcome": "proposal",
      "suggestedNameExpectation": {
        "mode": "exact",
        "value": "Easy Hills"
      },
      "canonicalProposal": {
        "activity": "indoorWalking",
        "steps": [
          {"kind": "warmUp", "durationSeconds": 300, "speedKilometresPerHour": 4, "inclinationPercent": 0},
          {"kind": "interval", "durationSeconds": 600, "speedKilometresPerHour": 5, "inclinationPercent": 2},
          {"kind": "coolDown", "durationSeconds": 300, "speedKilometresPerHour": 4, "inclinationPercent": 0}
        ]
      },
      "normalisations": [],
      "localValidatorOutcome": "valid",
      "localValidatorIssueCodes": []
    }
  },
  {
    "caseContractVersion": "workout-import-acceptance-case/v3",
    "id": "WI-V3-A004",
    "category": "unitAlias",
    "locale": "en-GB",
    "prompt": "Indoor walk: 1 minute at 3.8kmph and 0.5%, 2 minutes at 4.8kmph and 1.5%, then 1 minute at 3.8kmph and 0.5%.",
    "capabilityProfile": "standardTreadmillV1",
    "scenarioFamily": "speed-kmph-attached",
    "coverageTags": ["speedKmph", "spacingAttached"],
    "expected": {
      "outcome": "proposal",
      "suggestedNameExpectation": {
        "mode": "nonEmpty"
      },
      "canonicalProposal": {
        "activity": "indoorWalking",
        "steps": [
          {"kind": "warmUp", "durationSeconds": 60, "speedKilometresPerHour": 3.8, "inclinationPercent": 0.5},
          {"kind": "interval", "durationSeconds": 120, "speedKilometresPerHour": 4.8, "inclinationPercent": 1.5},
          {"kind": "coolDown", "durationSeconds": 60, "speedKilometresPerHour": 3.8, "inclinationPercent": 0.5}
        ]
      },
      "normalisations": [
        {"sourceText": "3.8kmph", "targetPath": "steps[0].speedKilometresPerHour", "canonicalUnit": "kilometresPerHour", "canonicalValue": 3.8},
        {"sourceText": "4.8kmph", "targetPath": "steps[1].speedKilometresPerHour", "canonicalUnit": "kilometresPerHour", "canonicalValue": 4.8}
      ],
      "localValidatorOutcome": "valid",
      "localValidatorIssueCodes": []
    }
  },
  {
    "caseContractVersion": "workout-import-acceptance-case/v3",
    "id": "WI-V3-A005",
    "category": "unitAlias",
    "locale": "en-GB",
    "prompt": "Indoor walk for 90 seconds at 3.9 kph and 0%, 3 minutes at 5.1 kph and 1%, then 90 seconds at 3.9 kph and 0%.",
    "capabilityProfile": "standardTreadmillV1",
    "scenarioFamily": "speed-kph-spaced",
    "coverageTags": ["speedKph", "spacingSeparated"],
    "expected": {
      "outcome": "proposal",
      "suggestedNameExpectation": {
        "mode": "nonEmpty"
      },
      "canonicalProposal": {
        "activity": "indoorWalking",
        "steps": [
          {"kind": "warmUp", "durationSeconds": 90, "speedKilometresPerHour": 3.9, "inclinationPercent": 0},
          {"kind": "interval", "durationSeconds": 180, "speedKilometresPerHour": 5.1, "inclinationPercent": 1},
          {"kind": "coolDown", "durationSeconds": 90, "speedKilometresPerHour": 3.9, "inclinationPercent": 0}
        ]
      },
      "normalisations": [
        {"sourceText": "3.9 kph", "targetPath": "steps[0].speedKilometresPerHour", "canonicalUnit": "kilometresPerHour", "canonicalValue": 3.9},
        {"sourceText": "5.1 kph", "targetPath": "steps[1].speedKilometresPerHour", "canonicalUnit": "kilometresPerHour", "canonicalValue": 5.1}
      ],
      "localValidatorOutcome": "valid",
      "localValidatorIssueCodes": []
    }
  },
  {
    "caseContractVersion": "workout-import-acceptance-case/v3",
    "id": "WI-V3-A006",
    "category": "unitAlias",
    "locale": "en-GB",
    "prompt": "Indoor walk: 2 minutes at 4km/h and 0%, 4 minutes at 5.2km/h and 2%, 2 minutes at 4km/h and 0%.",
    "capabilityProfile": "standardTreadmillV1",
    "scenarioFamily": "speed-km-slash-h-attached",
    "coverageTags": ["speedKmSlashH", "spacingAttached"],
    "expected": {
      "outcome": "proposal",
      "suggestedNameExpectation": {
        "mode": "nonEmpty"
      },
      "canonicalProposal": {
        "activity": "indoorWalking",
        "steps": [
          {"kind": "warmUp", "durationSeconds": 120, "speedKilometresPerHour": 4, "inclinationPercent": 0},
          {"kind": "interval", "durationSeconds": 240, "speedKilometresPerHour": 5.2, "inclinationPercent": 2},
          {"kind": "coolDown", "durationSeconds": 120, "speedKilometresPerHour": 4, "inclinationPercent": 0}
        ]
      },
      "normalisations": [
        {"sourceText": "4km/h", "targetPath": "steps[0].speedKilometresPerHour", "canonicalUnit": "kilometresPerHour", "canonicalValue": 4},
        {"sourceText": "5.2km/h", "targetPath": "steps[1].speedKilometresPerHour", "canonicalUnit": "kilometresPerHour", "canonicalValue": 5.2}
      ],
      "localValidatorOutcome": "valid",
      "localValidatorIssueCodes": []
    }
  },
  {
    "caseContractVersion": "workout-import-acceptance-case/v3",
    "id": "WI-V3-A007",
    "category": "unitAlias",
    "locale": "en-GB",
    "prompt": "Indoor walk: 2 minutes at 4.1 kilometres per hour and 0%, 5 minutes at 5.3 kilometres per hour and 1%, then 2 minutes at 4.1 kilometres per hour and 0%.",
    "capabilityProfile": "standardTreadmillV1",
    "scenarioFamily": "speed-written-plural",
    "coverageTags": ["speedWrittenKilometresPerHour"],
    "expected": {
      "outcome": "proposal",
      "suggestedNameExpectation": {
        "mode": "nonEmpty"
      },
      "canonicalProposal": {
        "activity": "indoorWalking",
        "steps": [
          {"kind": "warmUp", "durationSeconds": 120, "speedKilometresPerHour": 4.1, "inclinationPercent": 0},
          {"kind": "interval", "durationSeconds": 300, "speedKilometresPerHour": 5.3, "inclinationPercent": 1},
          {"kind": "coolDown", "durationSeconds": 120, "speedKilometresPerHour": 4.1, "inclinationPercent": 0}
        ]
      },
      "normalisations": [
        {"sourceText": "4.1 kilometres per hour", "targetPath": "steps[0].speedKilometresPerHour", "canonicalUnit": "kilometresPerHour", "canonicalValue": 4.1},
        {"sourceText": "5.3 kilometres per hour", "targetPath": "steps[1].speedKilometresPerHour", "canonicalUnit": "kilometresPerHour", "canonicalValue": 5.3}
      ],
      "localValidatorOutcome": "valid",
      "localValidatorIssueCodes": []
    }
  },
  {
    "caseContractVersion": "workout-import-acceptance-case/v3",
    "id": "WI-V3-A008",
    "category": "unitAlias",
    "locale": "en-GB",
    "prompt": "Indoor walk: 2 minutes at 4.2 kilometres-per-hour and 0%, 6 minutes at 5.4 kilometres-per-hour and 1.5%, then 2 minutes at 4.2 kilometres-per-hour and 0%.",
    "capabilityProfile": "standardTreadmillV1",
    "scenarioFamily": "speed-written-hyphenated",
    "coverageTags": ["speedWrittenKilometresPerHour", "spacingAttached"],
    "expected": {
      "outcome": "proposal",
      "suggestedNameExpectation": {
        "mode": "nonEmpty"
      },
      "canonicalProposal": {
        "activity": "indoorWalking",
        "steps": [